Name	Values	Coverage	Question	Example	Type	Source	SortIndex	IsComputed	IsRequired	IsConceptDelimiter	Cue
version	658	100%	What is the semantic version number?	169.0.2	string		1		true	true	📦
releaseDate	658	100%	Base parser all measures extend.	1/27/2025	string		1.1	true	true		
bugFixes	658	100%	How many bug fixes in this release?	1	number		1.2	true			
newFeatures	658	100%	How many new features in this release?	0	number		1.2	true			
breakingChanges	658	100%	How many breaking changes in this release?	0	number		1.2	true			